{
  "persona": "prose-reader",
  "seed": 1,
  "turns": 250,
  "done": {
    "reason": "turn-cap",
    "why": "I ran out of turns, which is how this one ended. I'd made my way back to the sleeping cyclops for a rematch with the thief and was standing at the foot of the stairs to his hideaway. I had just typed \"up\" when the world said I'd used all 250 turns. Most of my turns went into mapping the maze, twice over."
  },
  "about": "It's the white house and the caves under it, with the far reaches closed off. Every way out of the middle caves ends in black water, a cave-in, or a dam \"closed for inspection.\" So the place narrows to one path: kill the troll, get through the maze, feed and water the cyclops, and climb up to where a tidy, smug thief keeps his hoard. The thief is everywhere. He picks up what you drop, remarks on it from a distance, piles it in a dead end, and even puts your lamp back after you die. In the end it's a game about a burglar who keeps house.",
  "ending": {
    "reached": "no",
    "what": "I got as far as the Treasure Room and fought the thief once. He killed me. I came back, got my things together, and had just reached the sleeping cyclops again when my turns ran out."
  },
  "moments": [
    {
      "turn": 14,
      "kind": "delight",
      "note": "The gothic lettering translates to \"This space intentionally left blank.\" Good dry joke."
    },
    {
      "turn": 21,
      "kind": "delight",
      "note": "The air down the passage \"smells faintly of something that has not bathed\". The troll gets announced before I ever see him."
    },
    {
      "turn": 23,
      "kind": "delight",
      "note": "The troll description: \"watching you the way a cook watches a chicken\", with teeth \"not all of them his own\"."
    },
    {
      "turn": 31,
      "kind": "surprise",
      "note": "The cave-in rubble is sorted into neat heaps, smallest nearest. Somebody tidy lives down here, and that sets up the thief."
    },
    {
      "turn": 47,
      "kind": "delight",
      "note": "The crack is \"too narrow for most insects.\""
    },
    {
      "turn": 56,
      "kind": "frustration",
      "note": "The Chasm description mentions a crack opening into a passage, but \"examine crack\" said there was no such thing."
    },
    {
      "turn": 103,
      "kind": "frustration",
      "note": "\"take bag and key\" took only the key. The game read \"bag\" as the brown sack I was already carrying and ignored the leather bag of coins."
    },
    {
      "turn": 107,
      "kind": "delight",
      "note": "The rusty knife: \"The rust has not touched the edge. That is not a thing rust usually overlooks.\" A quiet, ominous line."
    },
    {
      "turn": 130,
      "kind": "delight",
      "note": "A distant voice: \"My, I wonder what this fine lunch is doing here.\" The thief tidies up after me."
    },
    {
      "turn": 145,
      "kind": "frustration",
      "note": "The maze is a long slog. Every room reads \"Maze\", some exits are one-way, and I spent dozens of turns mapping it by dropping things that the thief then picked up."
    },
    {
      "turn": 146,
      "kind": "surprise",
      "note": "The thief's stash of my lunch and bottle turned up in a dead end, and it's what I needed for the cyclops."
    },
    {
      "turn": 213,
      "kind": "delight",
      "note": "The cyclops takes the bottle and \"checks that it's open\". Nice touch, since he'd gotten agitated when I first handed it over closed."
    },
    {
      "turn": 220,
      "kind": "frustration",
      "note": "The thief killed me in four exchanges, and I had no chance to back off."
    },
    {
      "turn": 220,
      "kind": "delight",
      "note": "The death text: \"somebody tidy has put the lamp back in the living room.\" It turns a penalty into characterization."
    },
    {
      "turn": 191,
      "kind": "confusion",
      "note": "On my second visit the Cyclops Room didn't mention the cyclops at all. Only examining him showed he was there."
    }
  ],
  "wished": [
    "To go around the cave-ins, cross the black water, or open the dam. Every edge of the map closed off with a nice sentence and nothing to do.",
    "To examine the crack the Chasm description mentions.",
    "Rooms in the maze with even a small difference in their descriptions, so I could find my way by reading rather than by leaving my things behind.",
    "To pick up the leather bag of coins by calling it a bag.",
    "To back away from the thief or bargain with him instead of fighting to the death in four swings."
  ],
  "lines": [
    {
      "turn": 23,
      "line": "He is watching you the way a cook watches a chicken.",
      "why": "Funny and threatening in one short sentence. It set the voice for the whole place."
    },
    {
      "turn": 31,
      "line": "somebody has sorted the nearest of it into neat heaps, smallest nearest, the way some people tidy a room they have no intention of using.",
      "why": "It plants the idea of a tidy someone long before the thief shows up."
    },
    {
      "turn": 21,
      "line": "The air that comes down it is cold, and smells faintly of something that has not bathed.",
      "why": "It announces the troll through smell, before he's in view."
    },
    {
      "turn": 107,
      "line": "The rust has not touched the edge. That is not a thing rust usually overlooks.",
      "why": "The best sentence I read. Understated, and it suggests something without saying it."
    },
    {
      "turn": 102,
      "line": "Whatever he came into the maze looking for, the maze found him first.",
      "why": "A well-turned epitaph for the skeleton."
    },
    {
      "turn": 220,
      "line": "anything of value has rolled into some dark corner in or under it, and somebody tidy has put the lamp back in the living room.",
      "why": "Even dying fit the thief's character."
    },
    {
      "turn": 53,
      "line": "a black slot in the floor of the world, too deep for any light to find the bottom",
      "why": "A striking image for the chasm."
    },
    {
      "turn": 149,
      "line": "It smells of hot peppers from across the room, and of more hot peppers from closer to.",
      "why": "The comic rhythm made me laugh."
    }
  ],
  "ratings": {
    "fun": {
      "score": 3,
      "why": "The troll fight, the Loud Room echo, feeding the cyclops, and the thief's voice drifting through the maze were all good fun. A long stretch of maze mapping and a quick death to the thief dragged it down.",
      "turns": [
        26,
        43,
        130,
        145,
        213,
        220
      ]
    },
    "engagement": {
      "score": 4,
      "why": "The tidy-someone thread kept me curious from the heaped rubble to the thief putting my lamp back. I wanted to get back up those stairs.",
      "turns": [
        31,
        130,
        146,
        220,
        243
      ]
    },
    "difficulty": {
      "score": 4,
      "felt": "too hard",
      "why": "The cyclops puzzle was fair. The maze took far more turns than it was worth, and the thief killed me before I could react. Together they used up the session.",
      "turns": [
        145,
        165,
        189,
        220
      ]
    },
    "interestingness": {
      "score": 4,
      "why": "Making the thief into a tidy housekeeper is a real idea, and it shows in the rubble, the dead-end stash, and the death text. Most of the blocked exits are written as little stories of their own.",
      "turns": [
        31,
        47,
        61,
        130,
        220
      ]
    },
    "prose": {
      "score": 5,
      "why": "Whenever the writing is new rather than familiar, it's excellent: dry, precise, and funny, with real rhythm. The troll, the knife, the skeleton, the chasm, and the death text all stand out. The bare \"Maze\" rooms are the only flat stretch.",
      "turns": [
        14,
        21,
        23,
        53,
        102,
        107,
        149,
        220
      ]
    }
  }
}
