{
  "persona": "parser-breaker",
  "seed": 1,
  "turns": 17,
  "about": "A Zork II-style cave adventure. You start sealed in a barrow, go through a cavern with a wizard who pops in and out, and reach a garden with a gazebo. Treasures lie further south, past a pearl door with a riddle and a room that will not keep still.",
  "done": {
    "reason": "bored",
    "why": "I took a short sample of the opening and stopped before reaching any puzzle."
  },
  "ending": {
    "reached": "no",
    "what": null
  },
  "moments": [
    {
      "turn": 5,
      "kind": "surprise",
      "note": "The Wizard reads my empty hands and gives directions to the treasure."
    },
    {
      "turn": 10,
      "kind": "confusion",
      "note": "The room 'settles down and is only a room'. I did not know what that meant."
    },
    {
      "turn": 13,
      "kind": "delight",
      "note": "Stabbing the unicorn with a lantern got a witty reply that sounded like a verdict on my character."
    },
    {
      "turn": 1,
      "kind": "frustration",
      "note": "A politely phrased request to the sword was not understood."
    }
  ],
  "wished": [
    "To interact with the grue on the bridge",
    "To be able to read the Zork I copy"
  ],
  "lines": [
    {
      "turn": 13,
      "line": "The unicorn, unsurprised by this evidence that you are indeed the uncouth sort of vagabond it suspected you were, melts into the hedges and is gone.",
      "why": "The world responded to my odd action with a joke."
    },
    {
      "turn": 5,
      "line": "His eye goes to your hands, which hold nothing he values, and he relaxes a little",
      "why": "The wizard reacted to what I was carrying."
    }
  ],
  "ratings": {
    "fun": {
      "score": 3,
      "why": "Some witty responses, but I played only briefly.",
      "turns": [
        13,
        5
      ]
    },
    "engagement": {
      "score": 3,
      "why": "The hints at a room that will not keep still made me curious.",
      "turns": [
        5,
        10
      ]
    },
    "difficulty": {
      "score": 3,
      "why": "I did not get far enough to judge.",
      "turns": [
        1,
        3
      ],
      "felt": "right"
    },
    "interestingness": {
      "score": 4,
      "why": "A Zork pastiche that responds to what you carry and what you do.",
      "turns": [
        5,
        13,
        15
      ]
    },
    "prose": {
      "score": 4,
      "why": "Confident and funny.",
      "turns": [
        5,
        13
      ]
    }
  }
}
