{
  "persona": "casual",
  "seed": 1,
  "about": "A Zork-style start: the white house, kitchen, living room, trap door to a cellar and a troll, with the underground apparently still under construction.",
  "done": {
    "reason": "stuck",
    "why": "Every exit past the troll room turned out to be an unfinished dead end with a joke note. I had killed the troll and there was nowhere left to go, so I quit."
  },
  "ending": {
    "reached": "no",
    "what": null
  },
  "moments": [
    {
      "turn": 2,
      "kind": "confusion",
      "note": "'take leaflet' failed with 'can't see any such thing' right after the mailbox revealed one."
    },
    {
      "turn": 9,
      "kind": "surprise",
      "note": "Going down shut the trap door behind me, and the cellar is reached without the usual Zork steps."
    },
    {
      "turn": 13,
      "kind": "delight",
      "note": "The sword glowing blue and then brightly, and the troll fight, work as in the classic."
    },
    {
      "turn": 15,
      "kind": "delight",
      "note": "The unfinished passage with the pick and the note 'Back soon. -- The Management.'"
    },
    {
      "turn": 18,
      "kind": "frustration",
      "note": "The crawlway south ends at a plaque saying excavation is suspended. Every way on is blocked, so the game ran out after about 15 turns."
    }
  ],
  "wished": [
    "Somewhere to go after the troll.",
    "A leaflet I could actually take and read.",
    "The rest of the underground."
  ],
  "lines": [
    {
      "turn": 15,
      "line": "The passage to the east has not been finished. Someone has left a pick leaning against the rock, and a note: \"Back soon. -- The Management.\"",
      "why": "Funny, but it also told me the world was out of content."
    },
    {
      "turn": 17,
      "line": "EXCAVATION SUSPENDED BY ORDER OF THE FROBOZZ MAGIC TUNNELLING COMPANY.",
      "why": "A second wall, with the same joke."
    }
  ],
  "ratings": {
    "fun": {
      "score": 2,
      "why": "The familiar opening was fun for a few turns, then it ran out.",
      "turns": [
        5,
        13,
        15
      ]
    },
    "engagement": {
      "score": 2,
      "why": "I lost interest once all the exits were blocked.",
      "turns": [
        15,
        17
      ]
    },
    "difficulty": {
      "score": 1,
      "felt": "too easy",
      "why": "The troll died in four swings and there were no puzzles to solve.",
      "turns": [
        12,
        13
      ]
    },
    "interestingness": {
      "score": 2,
      "why": "It is a familiar Zork opening with a small twist, and it ends quickly.",
      "turns": [
        9,
        15
      ]
    },
    "prose": {
      "score": 3,
      "why": "The Zork text is solid and the dead-end notes are witty.",
      "turns": [
        4,
        15,
        17
      ]
    }
  },
  "turns": 18
}
