{
  "persona": "newcomer",
  "seed": 1,
  "turns": 20,
  "done": {
    "reason": "stuck",
    "why": "A wizard cast a fence in the Dark Tunnel. Every exit but the way I came was blocked, and the way back (northeast) was blocked too. I could not find any way out."
  },
  "about": "An underground cave adventure that feels like Zork. You start in a barrow with a lamp and a sword. You cross a bridge, pass through a great cavern, and enter a dark tunnel where a wizard shows up.",
  "ending": {
    "reached": "no",
    "what": null
  },
  "moments": [
    {
      "turn": 3,
      "kind": "confusion",
      "note": "'Cross the bridge south' said 'You can't see any such thing.' The world seems to want plain direction words."
    },
    {
      "turn": 6,
      "kind": "surprise",
      "note": "Going south put me in pitch black with a grue warning."
    },
    {
      "turn": 7,
      "kind": "surprise",
      "note": "A wizard appeared and cast a Fence spell."
    },
    {
      "turn": 8,
      "kind": "frustration",
      "note": "Southeast, southwest and northeast were all blocked, and nothing hinted at how to get out."
    },
    {
      "turn": 10,
      "kind": "confusion",
      "note": "'Examine the fence' wasn't understood, so I could not look closer at the obstacle."
    },
    {
      "turn": 14,
      "kind": "frustration",
      "note": "Waiting, saying 'fence' and waving the sword all did nothing. I was stuck."
    }
  ],
  "wished": [
    "Examine or look at the fence and the wizard.",
    "Retreat the way I came, since the fence also blocked the way back.",
    "Some hint about what the fence wants from me."
  ],
  "lines": [
    {
      "turn": 7,
      "line": "The Wizard, in a deep and resonant voice, speaks the word \"Fence!\" He then vanishes, cackling gleefully.",
      "why": "This is the moment I got trapped, and it is also the most vivid line."
    },
    {
      "turn": 6,
      "line": "It is pitch black. You are likely to be eaten by a grue.",
      "why": "A tense warning that did what it was meant to."
    }
  ],
  "ratings": {
    "fun": {
      "score": 2,
      "why": "The opening was pleasant, but I got trapped within about 20 turns.",
      "turns": [
        7,
        8
      ]
    },
    "engagement": {
      "score": 3,
      "why": "The cavern and the wizard's arrival drew me in, until the dead end.",
      "turns": [
        5,
        7
      ]
    },
    "difficulty": {
      "score": 5,
      "why": "With every exit blocked and nothing to try, I could not make any progress.",
      "turns": [
        8,
        9,
        14
      ],
      "felt": "too hard"
    },
    "interestingness": {
      "score": 3,
      "why": "The cave setting and the wizard are promising, but I saw little of them.",
      "turns": [
        5,
        7
      ]
    },
    "prose": {
      "score": 4,
      "why": "The descriptions were atmospheric and clear.",
      "turns": [
        2,
        5,
        7
      ]
    }
  }
}
