{
  "persona": "newcomer",
  "seed": 1,
  "turns": 16,
  "done": {
    "reason": "bored",
    "why": "I had seen a dragon, a wizard and a disorienting room, and had no clear goal. I stopped after a short wander."
  },
  "about": "A cave-exploring adventure that starts in a barrow. There are treasures south of a ravine, a meddling wizard, a dragon, and a disorienting carousel room. I never found a goal.",
  "ending": {
    "reached": "no",
    "what": null
  },
  "moments": [
    {
      "turn": 4,
      "kind": "surprise",
      "note": "The wizard appeared, hinted that treasure lies south, and made me drop the lamp."
    },
    {
      "turn": 6,
      "kind": "confusion",
      "note": "Moving south into the dark gave a grue warning, and I had to guess to turn the lamp on."
    },
    {
      "turn": 9,
      "kind": "confusion",
      "note": "The carousel room would not let me pick a direction."
    },
    {
      "turn": 11,
      "kind": "surprise",
      "note": "The dragon room, and the dragon just watched me."
    }
  ],
  "wished": [
    "Some sign of what I was supposed to do.",
    "A way to understand the dragon."
  ],
  "lines": [
    {
      "turn": 4,
      "line": "It is all south of the ravine, his look says, every treasure the Empire mislaid, and much good may it do you.",
      "why": "It was the only hint of a goal."
    }
  ],
  "ratings": {
    "fun": {
      "score": 3,
      "why": "Exploring was pleasant, but I had no goal.",
      "turns": [
        1,
        11
      ]
    },
    "engagement": {
      "score": 3,
      "why": "The dragon and the wizard were intriguing, but I left early.",
      "turns": [
        4,
        11
      ]
    },
    "difficulty": {
      "score": 3,
      "felt": "right",
      "why": "Simple commands worked. The dark and the carousel room were a little confusing.",
      "turns": [
        6,
        9
      ]
    },
    "interestingness": {
      "score": 4,
      "why": "The setting has a lot in it: wizard, dragon, frescoes, bridges.",
      "turns": [
        4,
        11,
        12
      ]
    },
    "prose": {
      "score": 4,
      "why": "The descriptions were clear and atmospheric, and the wizard's look was nicely written.",
      "turns": [
        4,
        11
      ]
    }
  }
}
