{
  "persona": "newcomer",
  "seed": 1,
  "turns": 15,
  "done": {
    "reason": "bored",
    "why": "I had seen a handful of places and picked up a few things. I couldn't tell what to do next, and I had cut myself off from the ledge, so I stopped."
  },
  "about": "An underground dungeon world. You arrive at the bottom of a stair after a dream about a final test. You explore passages, a sunlit cliff, a sea and a ledge. Something unseen, perhaps a person, watches and plays with you from above.",
  "ending": {
    "reached": "no",
    "what": "None reached. I left holding a lantern, bread and a vial."
  },
  "moments": [
    {
      "turn": 2,
      "kind": "surprise",
      "note": "Walking south in the dark gave a grue warning straight away."
    },
    {
      "turn": 4,
      "kind": "delight",
      "note": "Pulling the sword got a joke reply: 'Who do you think you are? Arthur?'"
    },
    {
      "turn": 8,
      "kind": "surprise",
      "note": "On the ledge, something unseen above twitched the rope and laughed at me."
    },
    {
      "turn": 10,
      "kind": "confusion",
      "note": "'Call out hello' was not understood. The shout command just gave 'Aaaarrrrgggghhhh!'"
    },
    {
      "turn": 13,
      "kind": "delight",
      "note": "Saying hello to the sailor made him give me a gift, the vial."
    },
    {
      "turn": 11,
      "kind": "frustration",
      "note": "The rope wouldn't climb up and I couldn't tell what to do about the watcher."
    }
  ],
  "wished": [
    "Talk to the unseen watcher above the cliff.",
    "Know how to open the locked chest.",
    "Have a clearer sense of what the final test was."
  ],
  "lines": [
    {
      "turn": 8,
      "line": "Far above you, at the brink of the cliff, something that is not a tree moves against the light, and the rope twitches once",
      "why": "It made the world feel inhabited."
    },
    {
      "turn": 13,
      "line": "I have waited three ages for someone to say those words",
      "why": "Plain 'hello' was the right move, and it paid off."
    }
  ],
  "ratings": {
    "fun": {
      "score": 3,
      "why": "Small discoveries and humour, but little direction.",
      "turns": [
        4,
        8,
        13
      ]
    },
    "engagement": {
      "score": 3,
      "why": "The watcher hooked me, but I stopped early.",
      "turns": [
        8,
        11
      ]
    },
    "difficulty": {
      "score": 3,
      "why": "Mostly gentle, though the goal wasn't clear and the scramble down was a one-way move.",
      "felt": "right",
      "turns": [
        11,
        12
      ]
    },
    "interestingness": {
      "score": 4,
      "why": "Varied places and a mysterious presence.",
      "turns": [
        6,
        8,
        13
      ]
    },
    "prose": {
      "score": 4,
      "why": "Vivid scene descriptions and playful responses.",
      "turns": [
        6,
        8,
        13
      ]
    }
  }
}
